{
  "$schema": "https://json-schema.org/draft/2020-12/schema",
  "title": "Wazuh FIM AI triage reference output",
  "description": "Proposed reference contract, not an exported deployed schema. Source correlation needs additional validation.",
  "type": "object",
  "additionalProperties": false,
  "required": ["alert_id", "rule_id", "risk_classification", "confidence", "summary", "evidence", "mitre_techniques", "recommended_actions", "human_review_required"],
  "properties": {
    "alert_id": {"type": ["string", "null"]},
    "rule_id": {"type": "string", "enum": ["100100", "100101", "100102"]},
    "risk_classification": {"type": "string", "enum": ["low", "medium", "high", "critical"]},
    "confidence": {"type": "string", "enum": ["low", "medium", "high"]},
    "summary": {"type": "string", "minLength": 1},
    "evidence": {"type": "array", "minItems": 1, "items": {"type": "string", "minLength": 1}},
    "mitre_techniques": {"type": "array", "uniqueItems": true, "items": {"type": "string", "pattern": "^T[0-9]{4}(\\.[0-9]{3})?$"}},
    "recommended_actions": {"type": "array", "minItems": 1, "items": {"type": "string", "minLength": 1}},
    "human_review_required": {"const": true}
  }
}
